{
  "domain": "asean-obligation-implementation",
  "version": 2,
  "sample_id": "member-measures-sample-026",
  "as_of": "2026-09-22",
  "actors": [
    "东盟秘书处",
    "成员国谈判代表",
    "法律与技术审查人员",
    "企业信息发布人员"
  ],
  "facts": [
    "数字经济框架协议已进入签署准备，条款尚未生效",
    "货物贸易议定书与海关便利化措施同步推进签署准备",
    "东盟单一窗口议定书已生效，电子原产地证书交换义务已可落实",
    "各国仅确认本国事实，跨国依赖与互认条件由秘书处负责"
  ],
  "constraints": [
    "未生效条款不得被标记为已落实",
    "计划调整、期限延长、部分完成、证据退回必须保留原因",
    "便利化措施对企业公开的条件是法律与技术条件同时具备且证据通过审查",
    "多国敏感材料按成员分区保存，跨成员不可见"
  ],
  "agreements": [
    {
      "id": "ag-defa",
      "name": "东盟数字经济框架协议",
      "status": "signature_preparation",
      "entry_into_force": "not_in_force"
    },
    {
      "id": "ag-gtp",
      "name": "货物贸易议定书",
      "status": "signature_preparation",
      "entry_into_force": "not_in_force"
    },
    {
      "id": "ag-asw",
      "name": "东盟单一窗口议定书",
      "status": "in_force",
      "entry_into_force": "in_force",
      "effective_date": "2025-01-15"
    }
  ],
  "members": [
    {
      "id": "SG",
      "name": "新加坡",
      "authorities": [
        { "id": "customs-sg", "name": "新加坡关税局", "domain": "customs" },
        { "id": "imda", "name": "资讯通信媒体发展局", "domain": "etransactions" }
      ]
    },
    {
      "id": "TH",
      "name": "泰国",
      "authorities": [
        { "id": "customs-th", "name": "泰国海关厅", "domain": "customs" },
        { "id": "etda", "name": "电子交易发展局", "domain": "etransactions" }
      ]
    },
    {
      "id": "ID",
      "name": "印度尼西亚",
      "authorities": [
        { "id": "customs-id", "name": "印度尼西亚海关", "domain": "customs" },
        { "id": "kominfo", "name": "通信与信息技术部", "domain": "platform" }
      ]
    },
    {
      "id": "VN",
      "name": "越南",
      "authorities": [
        { "id": "customs-vn", "name": "越南海关总局", "domain": "customs" },
        { "id": "mic-vn", "name": "信息通信部", "domain": "etransactions" }
      ]
    },
    {
      "id": "KH",
      "name": "柬埔寨",
      "authorities": [
        { "id": "customs-kh", "name": "柬埔寨海关总署", "domain": "customs" },
        { "id": "ptc-kh", "name": "邮电部", "domain": "etransactions" }
      ]
    }
  ],
  "obligations": [
    {
      "id": "ob-asw-eco",
      "agreement_id": "ag-asw",
      "article": "第4条",
      "title": "电子原产地证书跨境交换与受理",
      "entry_into_force": "in_force"
    },
    {
      "id": "ob-asw-sw",
      "agreement_id": "ag-asw",
      "article": "第6条",
      "title": "国家单一窗口互联与电子申报",
      "entry_into_force": "in_force"
    },
    {
      "id": "ob-defa-07",
      "agreement_id": "ag-defa",
      "article": "第7条",
      "title": "电子文件、电子签名与电子合同的跨境互认",
      "entry_into_force": "not_in_force"
    },
    {
      "id": "ob-defa-11",
      "agreement_id": "ag-defa",
      "article": "第11条",
      "title": "数字交易平台监管合作与在线消费者保护",
      "entry_into_force": "not_in_force"
    },
    {
      "id": "ob-gtp-05",
      "agreement_id": "ag-gtp",
      "article": "第5条",
      "title": "海关事项预先裁定",
      "entry_into_force": "not_in_force"
    }
  ],
  "tasks": [
    {
      "id": "t-sg-eco",
      "obligation_id": "ob-asw-eco",
      "member_id": "SG",
      "authority_id": "customs-sg",
      "title": "海关受理ASW电子原产地证书并接入国家单一窗口",
      "legal_revision": { "required": false, "note": "现行《电子交易法》已承认电子单证效力" },
      "technical_interface": { "required": true, "spec": "ASW eCO Gateway / UN/CEFACT 报文", "conformance": "passed" },
      "budget": { "status": "approved" },
      "deadline": "2026-03-31",
      "evidence_required": ["asw-conformance-report", "customs-ops-record"],
      "exemption": null,
      "claimed_status": "implemented",
      "fact_confirmed": { "by_member": "SG", "at": "2026-04-08" }
    },
    {
      "id": "t-th-eco",
      "obligation_id": "ob-asw-eco",
      "member_id": "TH",
      "authority_id": "customs-th",
      "title": "修订海关条例并完成ASW电子原产地证书联调",
      "legal_revision": {
        "required": true,
        "instrument": "海关电子单证条例修订",
        "enactment_state": "enacted",
        "enacted_on": "2026-02-20"
      },
      "technical_interface": { "required": true, "spec": "ASW eCO Gateway", "conformance": "passed" },
      "budget": { "status": "approved" },
      "deadline": "2026-06-30",
      "evidence_required": ["asw-conformance-report", "legal-gazette", "customs-ops-record"],
      "exemption": null,
      "claimed_status": "implemented",
      "fact_confirmed": { "by_member": "TH", "at": "2026-07-02" }
    },
    {
      "id": "t-id-eco",
      "obligation_id": "ob-asw-eco",
      "member_id": "ID",
      "authority_id": "customs-id",
      "title": "海关法配套电子单证规章与ASW接口一致性改造",
      "legal_revision": {
        "required": true,
        "instrument": "海关条例电子单证章节",
        "enactment_state": "enacted",
        "enacted_on": "2026-03-11"
      },
      "technical_interface": { "required": true, "spec": "ASW eCO Gateway", "conformance": "failed" },
      "budget": { "status": "approved" },
      "deadline": "2026-06-30",
      "evidence_required": ["asw-conformance-report", "customs-ops-record"],
      "exemption": null,
      "claimed_status": "in_progress",
      "fact_confirmed": { "by_member": "ID", "at": "2026-07-15" }
    },
    {
      "id": "t-kh-eco",
      "obligation_id": "ob-asw-eco",
      "member_id": "KH",
      "authority_id": "customs-kh",
      "title": "电子海关法立法排期与ASW接口建设（过渡期内）",
      "legal_revision": {
        "required": true,
        "instrument": "电子海关法草案",
        "enactment_state": "drafted"
      },
      "technical_interface": { "required": true, "spec": "ASW eCO Gateway（试点）", "conformance": "testing" },
      "budget": { "status": "requested" },
      "deadline": "2027-06-30",
      "evidence_required": ["asw-conformance-report", "legal-gazette"],
      "exemption": {
        "clause": "ASW议定书第10条最不发达成员过渡期",
        "scope": "电子原产地证书在线受理义务",
        "notified": true,
        "valid_from": "2025-01-15",
        "valid_to": "2027-12-31"
      },
      "claimed_status": "in_progress",
      "fact_confirmed": null
    },
    {
      "id": "t-sg-sw",
      "obligation_id": "ob-asw-sw",
      "member_id": "SG",
      "authority_id": "customs-sg",
      "title": "单一窗口与东盟枢纽互联（电子申报）",
      "legal_revision": { "required": false, "note": "既有授权充分" },
      "technical_interface": { "required": true, "spec": "ASW Single Window Interconnect", "conformance": "passed" },
      "budget": { "status": "approved" },
      "deadline": "2026-03-31",
      "evidence_required": ["asw-conformance-report", "customs-ops-record"],
      "exemption": null,
      "claimed_status": "implemented",
      "fact_confirmed": { "by_member": "SG", "at": "2026-04-08" }
    },
    {
      "id": "t-th-sw",
      "obligation_id": "ob-asw-sw",
      "member_id": "TH",
      "authority_id": "customs-th",
      "title": "单一窗口互联口岸扩展",
      "legal_revision": { "required": false },
      "technical_interface": { "required": true, "spec": "ASW Single Window Interconnect", "conformance": "testing" },
      "budget": { "status": "approved" },
      "deadline": "2026-12-31",
      "evidence_required": ["asw-conformance-report"],
      "exemption": null,
      "claimed_status": "partially_complete",
      "fact_confirmed": { "by_member": "TH", "at": "2026-07-20" }
    },
    {
      "id": "t-sg-esig",
      "obligation_id": "ob-defa-07",
      "member_id": "SG",
      "authority_id": "imda",
      "title": "跨境电子签名互认指定机关与技术互操作准备",
      "legal_revision": {
        "required": true,
        "instrument": "电子交易法互认附则",
        "enactment_state": "enacted",
        "enacted_on": "2026-05-09"
      },
      "technical_interface": { "required": true, "spec": "跨境可信证书核验接口", "conformance": "passed" },
      "budget": { "status": "approved" },
      "deadline": "2026-12-31",
      "evidence_required": ["legal-gazette", "interop-test-report"],
      "exemption": null,
      "claimed_status": "in_progress",
      "fact_confirmed": { "by_member": "SG", "at": "2026-07-25" }
    },
    {
      "id": "t-th-esig",
      "obligation_id": "ob-defa-07",
      "member_id": "TH",
      "authority_id": "etda",
      "title": "电子交易法修订与互认清单编制",
      "legal_revision": {
        "required": true,
        "instrument": "电子交易法修订草案",
        "enactment_state": "drafted"
      },
      "technical_interface": { "required": true, "spec": "待定（依DEFA技术附件）", "conformance": "none" },
      "budget": { "status": "approved" },
      "deadline": "2027-06-30",
      "evidence_required": ["legal-gazette", "interop-test-report"],
      "exemption": null,
      "claimed_status": "in_progress",
      "fact_confirmed": null
    },
    {
      "id": "t-id-plat",
      "obligation_id": "ob-defa-11",
      "member_id": "ID",
      "authority_id": "kominfo",
      "title": "平台监管通知与消费者保护跨部门权限安排",
      "legal_revision": {
        "required": true,
        "instrument": "平台监管条例草案",
        "enactment_state": "drafted"
      },
      "technical_interface": { "required": true, "spec": "平台投诉与监管通报接口", "conformance": "none" },
      "budget": { "status": "requested" },
      "deadline": "2027-06-30",
      "evidence_required": ["legal-gazette", "platform-supervision-record"],
      "exemption": null,
      "claimed_status": "planned",
      "fact_confirmed": null
    },
    {
      "id": "t-vn-ruling",
      "obligation_id": "ob-gtp-05",
      "member_id": "VN",
      "authority_id": "customs-vn",
      "title": "预先裁定在线申请系统与海关规章衔接",
      "legal_revision": {
        "required": true,
        "instrument": "海关法实施细则修订",
        "enactment_state": "drafted"
      },
      "technical_interface": { "required": true, "spec": "预先裁定在线申请门户", "conformance": "none" },
      "budget": { "status": "requested" },
      "deadline": "2027-06-30",
      "evidence_required": ["legal-gazette", "system-acceptance-report"],
      "exemption": null,
      "claimed_status": "planned",
      "fact_confirmed": null
    },
    {
      "id": "t-vn-esig",
      "obligation_id": "ob-defa-07",
      "member_id": "VN",
      "authority_id": "mic-vn",
      "title": "电子签名字证书互认技术验证",
      "legal_revision": {